[
  {
    "edge_id": "e0024",
    "@timestamp": "2026-08-10T10:00:00Z",
    "source_host": "WS-ENG-12",
    "target_host": "WS-FIN-07",
    "identity": "CORP\\alice",
    "effective_identity": "CORP\\alice",
    "service": "rdp",
    "logon_id": "0xe0024",
    "privilege_state": "confirmed",
    "auth_state": "confirmed",
    "credential_transition": null,
    "evidence_refs": {
      "network": "net-e0024",
      "logon": "log-e0024",
      "privilege": "priv-e0024"
    }
  },
  {
    "edge_id": "e0025",
    "@timestamp": "2026-08-10T10:03:00Z",
    "source_host": "WS-FIN-07",
    "target_host": "SRV-APP-01",
    "identity": "CORP\\alice",
    "effective_identity": "CORP\\alice",
    "service": "rdp",
    "logon_id": "0xe0025",
    "privilege_state": "absent",
    "auth_state": "confirmed",
    "credential_transition": null,
    "evidence_refs": {
      "network": "net-e0025",
      "logon": "log-e0025",
      "privilege": null
    }
  }
]