[
  {
    "edge_id": "e0002",
    "@timestamp": "2026-08-10T10:00:00Z",
    "source_host": "WS-ENG-12",
    "target_host": "JUMP-PAW01",
    "identity": "CORP\\dom_admin",
    "effective_identity": "CORP\\dom_admin",
    "service": "rdp",
    "logon_id": "0xe0002",
    "privilege_state": "confirmed",
    "auth_state": "confirmed",
    "credential_transition": null,
    "evidence_refs": {
      "network": "net-e0002",
      "logon": "log-e0002",
      "privilege": "priv-e0002"
    }
  },
  {
    "edge_id": "e0003",
    "@timestamp": "2026-08-10T10:05:00Z",
    "source_host": "JUMP-PAW01",
    "target_host": "DC01",
    "identity": "CORP\\dom_admin",
    "effective_identity": "CORP\\dom_admin",
    "service": "rdp",
    "logon_id": "0xe0003",
    "privilege_state": "confirmed",
    "auth_state": "confirmed",
    "credential_transition": null,
    "evidence_refs": {
      "network": "net-e0003",
      "logon": "log-e0003",
      "privilege": "priv-e0003"
    }
  }
]