[
  {
    "edge_id": "e0008",
    "@timestamp": "2026-08-10T10:00:00Z",
    "source_host": "WS-ENG-12",
    "target_host": "SRV-APP-01",
    "identity": "CORP\\alice",
    "effective_identity": "CORP\\alice",
    "service": "rdp",
    "logon_id": "0xe0008",
    "privilege_state": "absent",
    "auth_state": "confirmed",
    "credential_transition": null,
    "evidence_refs": {
      "network": "net-e0008",
      "logon": "log-e0008",
      "privilege": null
    }
  },
  {
    "edge_id": "e0009",
    "@timestamp": "2026-08-10T10:04:00Z",
    "source_host": "SRV-APP-01",
    "target_host": "SRV-FILE-02",
    "identity": "CORP\\alice",
    "effective_identity": "CORP\\dom_admin",
    "service": "smb",
    "logon_id": "0xe0009",
    "privilege_state": "confirmed",
    "auth_state": "confirmed",
    "credential_transition": {
      "from_identity": "CORP\\alice",
      "to_identity": "CORP\\dom_admin",
      "state": "confirmed",
      "evidence_ref": "log-4648-e0009"
    },
    "evidence_refs": {
      "network": "net-e0009",
      "logon": "log-e0009",
      "privilege": "priv-e0009"
    },
    "source_logon_id": "0xe0008"
  }
]