[
  {
    "edge_id": "e0016",
    "@timestamp": "2026-08-10T10:00:00Z",
    "source_host": "WS-ENG-12",
    "target_host": "SRV-APP-01",
    "identity": "CORP\\bob",
    "effective_identity": "CORP\\bob",
    "service": "rdp",
    "logon_id": "0xe0016",
    "privilege_state": "confirmed",
    "auth_state": "confirmed",
    "credential_transition": null,
    "evidence_refs": {
      "network": "net-e0016",
      "logon": "log-e0016",
      "privilege": "priv-e0016"
    }
  },
  {
    "edge_id": "e0017",
    "@timestamp": "2026-08-10T10:03:00Z",
    "source_host": "SRV-APP-01",
    "target_host": "SRV-FILE-02",
    "identity": "CORP\\alice",
    "effective_identity": "CORP\\alice",
    "service": "smb",
    "logon_id": "0xe0017",
    "privilege_state": "absent",
    "auth_state": "confirmed",
    "credential_transition": null,
    "evidence_refs": {
      "network": "net-e0017",
      "logon": "log-e0017",
      "privilege": null
    }
  }
]